{
  "$schema": "./schemas/browser-longhand-keyword-contracts.schema.json",
  "schemaVersion": 1,
  "baseline": "Mozilla/5.0 (X11; Linux x86_64) AppleWebKit/537.36 (KHTML, like Gecko) HeadlessChrome/151.0.7922.34 Safari/537.36",
  "provenance": {
    "chromiumTag": "151.0.7922.34",
    "source": "third_party/blink/renderer/core/css/css_properties.json5",
    "sourceSha256": "d3d5002b536b529fa6a1ffd045282b39048675a81c7e27f55a99ff172ee74bcc"
  },
  "groups": [
    { "id": "webkit-font-smoothing", "properties": ["-webkit-font-smoothing"], "values": ["auto", "none", "antialiased", "subpixel-antialiased"] },
    { "id": "webkit-line-break", "properties": ["-webkit-line-break"], "values": ["auto", "loose", "normal", "strict", "after-white-space"] },
    { "id": "webkit-rtl-ordering", "properties": ["-webkit-rtl-ordering"], "values": ["logical", "visual"] },
    { "id": "webkit-ruby-position", "properties": ["-webkit-ruby-position"], "values": ["before", "after"] },
    { "id": "webkit-text-combine", "properties": ["-webkit-text-combine"], "values": ["none", "horizontal"] },
    { "id": "webkit-text-orientation", "properties": ["-webkit-text-orientation"], "values": ["sideways", "upright", "sideways-right", "vertical-right"] },
    { "id": "webkit-text-security", "properties": ["-webkit-text-security"], "values": ["none", "disc", "circle", "square"] },
    { "id": "webkit-user-drag", "properties": ["-webkit-user-drag"], "values": ["auto", "none", "element"] },
    { "id": "webkit-user-modify", "properties": ["-webkit-user-modify"], "values": ["read-only", "read-write", "read-write-plaintext-only"] },
    { "id": "webkit-writing-mode", "properties": ["-webkit-writing-mode"], "values": ["horizontal-tb", "vertical-rl", "vertical-lr"] },
    { "id": "alignment-baseline", "properties": ["alignment-baseline"], "values": ["auto", "baseline", "alphabetic", "ideographic", "middle", "central", "mathematical", "before-edge", "text-before-edge", "after-edge", "text-after-edge", "hanging"] },
    { "id": "app-region", "properties": ["app-region"], "values": ["none", "drag", "no-drag"] },
    { "id": "background-blend-mode", "properties": ["background-blend-mode"], "separator": "comma", "values": ["normal", "multiply", "screen", "overlay", "darken", "lighten", "color-dodge", "color-burn", "hard-light", "soft-light", "difference", "exclusion", "hue", "saturation", "color", "luminosity"] },
    { "id": "baseline-source", "properties": ["baseline-source"], "values": ["auto", "first", "last"] },
    { "id": "border-collapse", "properties": ["border-collapse"], "values": ["separate", "collapse"] },
    { "id": "break-between", "properties": ["break-after", "break-before"], "values": ["auto", "avoid", "avoid-column", "avoid-page", "column", "left", "page", "recto", "right", "verso"] },
    { "id": "break-inside", "properties": ["break-inside"], "values": ["auto", "avoid", "avoid-column", "avoid-page"] },
    { "id": "buffered-rendering", "properties": ["buffered-rendering"], "values": ["auto", "dynamic", "static"] },
    { "id": "caption-side", "properties": ["caption-side"], "values": ["top", "bottom"] },
    { "id": "caret-animation", "properties": ["caret-animation"], "values": ["auto", "manual"] },
    { "id": "clear", "properties": ["clear"], "values": ["none", "left", "right", "both", "inline-start", "inline-end"] },
    { "id": "column-fill", "properties": ["column-fill"], "values": ["balance", "auto"] },
    { "id": "column-span", "properties": ["column-span"], "values": ["none", "all"] },
    { "id": "content-visibility", "properties": ["content-visibility"], "values": ["visible", "auto", "hidden"] },
    { "id": "dominant-baseline", "properties": ["dominant-baseline"], "values": ["auto", "alphabetic", "ideographic", "middle", "central", "mathematical", "hanging", "use-script", "no-change", "reset-size", "text-after-edge", "text-before-edge"] },
    { "id": "empty-cells", "properties": ["empty-cells"], "values": ["show", "hide"] },
    { "id": "field-sizing", "properties": ["field-sizing"], "values": ["fixed", "content"] },
    { "id": "float", "properties": ["float"], "values": ["none", "left", "right", "inline-start", "inline-end"] },
    { "id": "forced-color-adjust", "properties": ["forced-color-adjust"], "values": ["auto", "none", "preserve-parent-color"] },
    { "id": "image-orientation", "properties": ["image-orientation"], "values": ["none", "from-image"] },
    { "id": "interactivity", "properties": ["interactivity"], "values": ["auto", "inert"] },
    { "id": "interpolate-size", "properties": ["interpolate-size"], "values": ["numeric-only", "allow-keywords"] },
    { "id": "isolation", "properties": ["isolation"], "values": ["auto", "isolate"] },
    { "id": "math-style", "properties": ["math-shift", "math-style"], "values": ["normal", "compact"] },
    { "id": "object-fit", "properties": ["object-fit"], "values": ["fill", "contain", "cover", "none", "scale-down"] },
    { "id": "overflow-anchor", "properties": ["overflow-anchor"], "values": ["visible", "none", "auto"] },
    { "id": "logical-overflow", "properties": ["overflow-block", "overflow-inline"], "values": ["visible", "hidden", "clip", "scroll", "auto"] },
    { "id": "overlay", "properties": ["overlay"], "values": ["none", "auto"] },
    { "id": "logical-overscroll", "properties": ["overscroll-behavior-block", "overscroll-behavior-inline"], "values": ["auto", "contain", "none"] },
    { "id": "page-margin-safety", "properties": ["page-margin-safety"], "values": ["none", "clamp", "add"] },
    { "id": "pointer-events", "properties": ["pointer-events"], "values": ["none", "auto", "stroke", "fill", "painted", "visible", "visiblestroke", "visiblefill", "visiblepainted", "bounding-box", "all"] },
    { "id": "reading-flow", "properties": ["reading-flow"], "values": ["normal", "flex-visual", "flex-flow", "grid-rows", "grid-columns", "grid-order", "source-order"] },
    { "id": "ruby-align", "properties": ["ruby-align"], "values": ["space-around", "start", "center", "space-between"] },
    { "id": "ruby-position", "properties": ["ruby-position"], "values": ["over", "under"] },
    { "id": "rule-break", "properties": ["column-rule-break", "row-rule-break"], "values": ["normal", "none", "intersection"] },
    { "id": "rule-overlap", "properties": ["rule-overlap"], "values": ["row-over-column", "column-over-row"] },
    { "id": "rule-visibility-items", "properties": ["column-rule-visibility-items", "row-rule-visibility-items"], "values": ["normal", "all", "between", "around"] },
    { "id": "scroll-behavior", "properties": ["scroll-behavior"], "values": ["auto", "smooth"] },
    { "id": "scroll-initial-target", "properties": ["scroll-initial-target"], "values": ["none", "nearest"] },
    { "id": "scroll-marker-group", "properties": ["scroll-marker-group"], "values": ["none", "after", "before"] },
    { "id": "scroll-snap-stop", "properties": ["scroll-snap-stop"], "values": ["normal", "always"] },
    { "id": "scroll-target-group", "properties": ["scroll-target-group"], "values": ["none", "auto"] },
    { "id": "scrollbar-width", "properties": ["scrollbar-width"], "values": ["auto", "thin", "none"] },
    { "id": "speak", "properties": ["speak"], "values": ["none", "normal", "spell-out", "digits", "literal-punctuation", "no-punctuation"] },
    { "id": "table-layout", "properties": ["table-layout"], "values": ["auto", "fixed"] },
    { "id": "text-anchor", "properties": ["text-anchor"], "values": ["start", "middle", "end"] },
    { "id": "text-combine-upright", "properties": ["text-combine-upright"], "values": ["none", "all"] },
    { "id": "text-orientation", "properties": ["text-orientation"], "values": ["sideways", "mixed", "upright", "sideways-right"] },
    { "id": "text-spacing-trim", "properties": ["text-spacing-trim"], "values": ["normal", "space-all", "space-first", "trim-start"] },
    { "id": "vector-effect", "properties": ["vector-effect"], "values": ["none", "non-scaling-stroke"] },
    { "id": "writing-mode", "properties": ["writing-mode"], "values": ["horizontal-tb", "vertical-rl", "vertical-lr", "sideways-rl", "sideways-lr", "lr", "rl", "tb", "lr-tb", "rl-tb", "tb-rl"] }
  ],
  "aliases": [
    { "property": "-webkit-app-region", "canonical": "app-region" },
    { "property": "-webkit-column-break-after", "canonical": "break-after", "hidesSemanticValue": true },
    { "property": "-webkit-column-break-before", "canonical": "break-before", "hidesSemanticValue": true },
    { "property": "-webkit-column-break-inside", "canonical": "break-inside", "hidesSemanticValue": true },
    { "property": "-webkit-column-span", "canonical": "column-span" }
  ]
}
